{
  "$schema": "http://json-schema.org/draft-07/schema#",
  "title": "LandingPage Translation Schema",
  "type": "object",
  "properties": {
    "ex_title_1": { "type": "string" },
    "ex_desc_1": { "type": "string" },
    "ex_title_2": { "type": "string" },
    "ex_desc_2": { "type": "string" },
    "ex_title_3": { "type": "string" },
    "ex_desc_3": { "type": "string" },
    "question": { "type": "string" },
    "quote": { "type": "string" },
    "no_more_searching": { "type": "string" },
    "intro_text": { "type": "string" },
    "what_is_template": { "type": "string" },
    "template_explanation_1": { "type": "string" },
    "template_explanation_2": { "type": "string" },
    "what_is_source_code": { "type": "string" },
    "source_code_explanation_1": { "type": "string" },
    "source_code_explanation_2": { "type": "string" },
    "target_title": { "type": "string" },
    "target_1": { "type": "string" },
    "target_2": { "type": "string" },
    "target_3": { "type": "string" },
    "go_login": { "type": "string" },
    "go_signup": { "type": "string" },
    "expand_source_code": { "type": "string" },
    "copy": { "type": "string" }
  },
  "required": [
    "ex_title_1",
    "ex_desc_1",
    "ex_title_2",
    "ex_desc_2",
    "ex_title_3",
    "ex_desc_3",
    "question",
    "quote",
    "no_more_searching",
    "intro_text",
    "what_is_template",
    "template_explanation_1",
    "template_explanation_2",
    "what_is_source_code",
    "source_code_explanation_1",
    "source_code_explanation_2",
    "target_title",
    "target_1",
    "target_2",
    "target_3",
    "go_login",
    "go_signup",
    "expand_source_code",
    "copy"
  ]
}
